MyGene2 profile,Pubmed ID,OMIM,Condition,Gene Name,Genetic variant(s),Other Genetic Variant(s),Phenotypes
1511,,310200,Duchenne muscular dystrophy,DMD,"c.2833C>T, p.(Gln945*), X-linked recessive, Uncertain significance",,
1512,,,,DMD,,,
1593,,310200,"Muscular Dystrophy, Duchenne Type,Duchenne muscular dystrophy",DMD,,,
3325,,,,DMD,,"DYSF, unknown / other, Uncertain significance; IL7R, unknown / other, Uncertain significance; NEB, unknown / other, Uncertain significance; TTN, unknown / other, Uncertain significance; YARS2, unknown / other, Uncertain significance; ANO5, unknown / other, Uncertain significance; FTL, autosomal recessive (compound heterozygous), Uncertain significance; COL6A3, unknown / other, Uncertain significance; COL6A2, unknown / other, Uncertain significance; COL6A1, unknown / other, Uncertain significance","HP:0020073,HP:0012531,HP:0012514,HP:0012734,HP:0008991,HP:0100614,HP:0011848,HP:0010546,HP:0009020,HP:0004324,HP:0003750,HP:0003738,HP:0003701,HP:0003546,HP:0003457,HP:0003394,HP:0003326,HP:0003236,HP:0003201,HP:0003198,HP:0002359,HP:0002315,HP:0002099,HP:0002020,HP:0002015,HP:0001945,HP:0001943,HP:0001771,HP:0001763,HP:0001622,HP:0001561,HP:0001511,HP:0001508,HP:0000651,HP:0000505,HP:0012378"
3808,,,,DMD,,"ABCA7, unknown / other, Uncertain significance; FBN1, unknown / other, Suspected pathogenic",HP:0009124
3811,,,,DMD,,"AGPAT2, unknown / other, Uncertain significance; NOTCH1, unknown / other, Uncertain significance; LPL, unknown / other, Uncertain significance; PIK3R1, unknown / other, Uncertain significance",HP:0009124
3818,,,,DMD,,,HP:0009124
4095,,,hereditary neuropathy with liability to pressure palsies,DMD,"c.9749 A>C, p.(Glu3250Ala), X-linked recessive, Uncertain significance","POMGNT1, c.1975 C>T, p.(Gln659*), autosomal recessive (compound heterozygous,  2nd variant unknown); NCOR1, de novo, Uncertain significance; ARHGAP44, de novo, Uncertain significance",HP:0001252
