MyGene2 profile,Pubmed ID,OMIM,Condition,Gene Name,Genetic variant(s),Other Genetic Variant(s),Phenotypes
333,,,SATB2 Associated Syndrome,LAMA2,"c.5260del, p.(Val1754*), autosomal dominant, Pathogenic","SATB2, c.1728del, p.(Glu577Serfs*47), autosomal dominant, Pathogenic","HP:0000175,HP:0001263,HP:0000717,HP:0001249"
1623,,,,LAMA2,"c.3626G>A, p.(Gly1209Asp), unknown / other, Uncertain significance","LMNA, c.1487C>T, p.(Thr496Met), unknown / other, Uncertain significance; AMIGO3, c.795G>T, p.(Gln265His), unknown / other, Uncertain significance",HP:0009830
2113,,,,LAMA2,"c.1657 C>T, p.(Arg553*), de novo, Likely pathogenic",,
2250,,,Undiagnosed,LAMA2,"c.5562+1G>A, , unknown / other, Likely pathogenic","PHKA1, c.2995C>T, p.(Arg999*), unknown / other, Likely pathogenic; SKI, c.1654G>A, p.(Gly552Ser), unknown / other, Uncertain significance; LRP2, c.1280T>G, p.(Val427Gly), unknown / other, Uncertain significance","HP:0004322,HP:0000256,HP:0001263,HP:0500093,HP:0012393,HP:0001510,HP:0002463,HP:0000717,HP:0001609,HP:0001945,HP:0007021,HP:0012531,HP:0001385,HP:0002015,HP:0002194,HP:0001270,HP:0001252,HP:0001324,HP:0004322,HP:0000256,HP:0001263,HP:0002194,HP:0001270,HP:0500093,HP:0012393,HP:0002019,HP:0002463,HP:0007021,HP:0012531,HP:0000717,HP:0001609,HP:0002360,HP:0002750,HP:0001385,HP:0002015,HP:0010296"
3273,,,,LAMA2,"c.9272_9290del, p.(Leu3091Glnfs*15), autosomal recessive (compound heterozygous), Pathogenic; c.2049_2050delAG, p.(Arg683Serfs*21), autosomal recessive (compound heterozygous), Pathogenic",,
3851,,,,LAMA2,"c.533 C>T, p.(Thr178Met), autosomal recessive (compound heterozygous), Uncertain significance; c.5291 A>G, p.(Glu1764Gly), autosomal recessive (compound heterozygous), Uncertain significance; c.6752 C>A, p.(Pro2251His), autosomal recessive (compound heterozygous,  2nd variant unknown)","NUBPL, c.468 G>A, p.(Trp156*), autosomal recessive (compound heterozygous,  2nd variant unknown)","HP:0011968,HP:0002509,HP:0002104,HP:0002098,HP:0001298,HP:0001290,HP:0001250,HP:0000431,HP:0002878"
