MyGene2 profile,Pubmed ID,OMIM,Condition,Gene Name,Genetic variant(s),Other Genetic Variant(s),Phenotypes
3145,,,,NEB,,,HP:0008056
3325,,,,NEB,,"DYSF, unknown / other, Uncertain significance; DMD, unknown / other, Uncertain significance; IL7R, unknown / other, Uncertain significance; TTN, unknown / other, Uncertain significance; YARS2, unknown / other, Uncertain significance; ANO5, unknown / other, Uncertain significance; FTL, autosomal recessive (compound heterozygous), Uncertain significance; COL6A3, unknown / other, Uncertain significance; COL6A2, unknown / other, Uncertain significance; COL6A1, unknown / other, Uncertain significance","HP:0100614,HP:0010546,HP:0001622,HP:0001763,HP:0001771,HP:0001943,HP:0001945,HP:0002015,HP:0002020,HP:0002099,HP:0002315,HP:0002359,HP:0003198,HP:0003201,HP:0003236,HP:0003326,HP:0003394,HP:0003457,HP:0003546,HP:0003701,HP:0003738,HP:0003750,HP:0004324,HP:0009020,HP:0011848,HP:0020073,HP:0008991,HP:0012734,HP:0012514,HP:0012531,HP:0012378,HP:0000505,HP:0000651,HP:0001508,HP:0001511,HP:0001561"
3375,,,stiff-person syndrome,NEB,"c.21173C>T, p.(Thr7058Ile), unknown / other, Uncertain significance","PRDM12, c.1068_1076dupCGCCGCCGC, p.(Ala357_Ala359dup), unknown / other, Uncertain significance; MUSK, c.665A>G, p.(Asn222Ser), unknown / other, Uncertain significance; AGRN, c.1606C>T, p.(Arg536Cys), unknown / other, Uncertain significance","HP:0001251,HP:0012514,HP:0001250,HP:0002076,HP:0001332,HP:0000718,HP:0002355,HP:0007340,HP:0012531,HP:0001337,HP:0003201,HP:0003326,HP:0001336,HP:0002098,HP:0100022,HP:0002268,HP:0009830,HP:0002791,HP:0001324,HP:0040292,HP:0002131,HP:0002487,HP:0001290"
3520,,,valosin containing protein,NEB,"c.18431A>G, p.(His6144Arg), unknown / other, Uncertain significance","VCP, c.463C>T, p.(Arg155Cys), autosomal dominant, Pathogenic; RYR1, c.4405C>T, p.(Arg1469Trp), unknown / other, Likely pathogenic; AGRN, c.3958G>A, p.(Gly1320Arg), unknown / other, Uncertain significance; PLEC, c.346-9T>G, unknown / other, Uncertain significance","HP:0001324,HP:0003198"
3712,,,,NEB,"c.23246G>A, p.(Arg7749Gln), unknown / other, Uncertain significance","CAPN3, c.479 C>G, p.(Ala160Gly), autosomal recessive (homozygous), Uncertain significance; SMN1, c.796T>C, p.(Ser266Pro), autosomal recessive (homozygous), Uncertain significance; DYNC1H1, c.11503A>G, p.(Ile3835Val), unknown / other, Likely benign; SBF2, c.2338G>A, p.(Gly780Arg), unknown / other, Uncertain significance; SETX, c.3640A>G, p.(Arg1214Gly), unknown / other, Uncertain significance; FKRP, c.1003G>A, p.(Ala335Thr), autosomal recessive (homozygous), Uncertain significance; MYOT, c.1413G>T, p.(Leu471Phe), autosomal dominant, Uncertain significance; PLEC, c.6279G>T, p.(Gln2093His), unknown / other, Uncertain significance; TTN, c.17027C>T, p.(Ala5676Val), autosomal recessive (compound heterozygous), Uncertain significance; TTN, c.43054C>G, p.(Pro14352Ala), autosomal recessive (compound heterozygous), Uncertain significance; TTN, c.49967G>A, p.(Arg16656His), unknown / other, Uncertain significance; PFKM, c.500A>G, p.(His167Arg), unknown / other, Uncertain significance; SBF1, c.992C>T, p.(Thr331Met), unknown / other, Uncertain significance","HP:0001609,HP:0003701,HP:0001324,HP:0003270"
3717,,,MYH7 related congenital myopathy,NEB,"c.11078G>A, p.(Arg3693His), unknown / other, Uncertain significance; c.24010C>T, p.(Arg8004Cys), unknown / other, Uncertain significance","MYH7, c.4186C>T, p.(Arg1396Trp), autosomal dominant, Likely pathogenic; PLEC, c.2686G>A, p.(Val896Ile), unknown / other, Uncertain significance",
3742,,,multi-minicore myopathy (not genetically confimed),NEB,"c.23774T>C, p.(Ile7925Thr), unknown / other, Uncertain significance",,"HP:0000992,HP:0001250,HP:0100021,HP:0003789,HP:0025406,HP:0002664,HP:0001635,HP:0002460,HP:0003701,HP:0003198,HP:0003560,HP:0002653,HP:0002829,HP:0033050,HP:0002047,HP:0001324,HP:0001945"
3825,,,,NEB,"c.24094 C>T, p.(Arg8032*), autosomal recessive (compound heterozygous), Likely pathogenic","DNAJB2, c.368delT, p.(Phe123Serfs*78), autosomal recessive (compound heterozygous), Likely pathogenic; DNAJB2, autosomal recessive (compound heterozygous), Likely pathogenic; DYSF, c.757 C>T, p.(Arg253Trp), autosomal recessive (compound heterozygous), Likely pathogenic; DYSF, autosomal recessive (compound heterozygous), Likely pathogenic",
5496,,,RYR1 Myopathy,NEB,"c.23615 C>T, p.(Thr7872MET), autosomal recessive (compound heterozygous), Uncertain significance","RYR1, c.6797-1 G>A, autosomal dominant, Likely pathogenic; CCDC78, c.492 C>T, p.(=), unknown / other, Uncertain significance","HP:0003198,HP:0001370,HP:0003473,HP:0000716,HP:0003560,HP:0012871,HP:0005943,HP:0002315,HP:0001962,HP:0001324,HP:0025406,HP:0002094,HP:0002791,HP:0033710,HP:0004885,HP:0002098,HP:0002046,HP:0025233,HP:0003470,HP:0002650,HP:0002015,HP:0002516,HP:0000822,HP:0003326,HP:0033050,HP:0001387,HP:0000508"
5539,,,,NEB,"c.10471A>G, p.(Met3491Val), unknown / other, Uncertain significance","TMEM67, c.622A>T, p.(Arg208*), autosomal recessive (compound heterozygous,  2nd variant unknown); HARS1, c.1402G>A, p.(Glu468Lys), unknown / other, Uncertain significance","HP:0001252,HP:0003307,HP:0002099,HP:0002515,HP:0000739,HP:0001263,HP:0000729,HP:0000717"
5977,,,,NEB,,"DSP, de novo, Uncertain significance",
6066,,,Nemaline myopathy,NEB,"c.5555T>G, p.(Met1852Arg), autosomal recessive (compound heterozygous), Uncertain significance; c.3264_3265del, p.(Tyr1088*), autosomal recessive (compound heterozygous), Uncertain significance","SYNE2, c.18632C>T, p.(Thr6211Met), unknown / other, Uncertain significance; CPLANE1, c.7477C>T, p.(Arg2493*), unknown / other, Uncertain significance; COQ8A, c.993C>T, p.(Phe331=), unknown / other, Uncertain significance; CDHR1, c.159C>A, p.(His53Gln), unknown / other, Uncertain significance; HFE, c.845G>A, p.(Cys282Tyr), unknown / other, Uncertain significance","HP:0002014,HP:0025388,HP:0000365,HP:0000729,HP:0001638,HP:0001324,HP:0025406,HP:0002791,HP:0002650,HP:0001370,HP:0002013,HP:0003198,HP:0012332,HP:0025643,HP:0002527,HP:0033050,HP:0002315,HP:0001945"
